{
  "format": "llm-foundations-bundle-v1",
  "schema_version": 1,
  "edition": "intermediate-v1",
  "bundle_mode": "full",
  "source": {
    "installation_id": "13131313-1313-4313-8313-131313131313",
    "app_version": "1.0.0"
  },
  "exported_at": "2026-09-28T12:00:00.000Z",
  "dependency_closure_complete": true,
  "contains_resume_state": false,
  "checkpoint_exports": [
    {
      "original_checkpoint_id": "10101010-1010-4010-8010-101010101010",
      "portability": "inference_only",
      "contains_resume_state": false
    }
  ],
  "omissions": [],
  "entries": [
    {
      "path": "llm-foundations-bundle/objects/base_model_file/smollm2-135m-instruct-v1/config.json",
      "size_bytes": 861,
      "sha256": "8eb740e8bbe4cff95ea7b4588d17a2432deb16e8075bc5828ff7ba9be94d982a",
      "media_type": "application/octet-stream",
      "object_type": "base_model_file",
      "original_object_id": "smollm2-135m-instruct-v1"
    },
    {
      "path": "llm-foundations-bundle/objects/base_model_file/smollm2-135m-instruct-v1/generation_config.json",
      "size_bytes": 132,
      "sha256": "87b916edaaab66b3899b9d0dd0752727dff6666686da0504d89ae0a6e055a013",
      "media_type": "application/octet-stream",
      "object_type": "base_model_file",
      "original_object_id": "smollm2-135m-instruct-v1"
    },
    {
      "path": "llm-foundations-bundle/objects/base_model_file/smollm2-135m-instruct-v1/merges.txt",
      "size_bytes": 466391,
      "sha256": "0b54e8aa4e53d5383e2e4bc635a56b43f9647f7b13832d5d9ecd8f82dac4f510",
      "media_type": "application/octet-stream",
      "object_type": "base_model_file",
      "original_object_id": "smollm2-135m-instruct-v1"
    },
    {
      "path": "llm-foundations-bundle/objects/base_model_file/smollm2-135m-instruct-v1/model.safetensors",
      "size_bytes": 269060552,
      "sha256": "5af571cbf074e6d21a03528d2330792e532ca608f24ac70a143f6b369968ab8c",
      "media_type": "application/octet-stream",
      "object_type": "base_model_file",
      "original_object_id": "smollm2-135m-instruct-v1"
    },
    {
      "path": "llm-foundations-bundle/objects/base_model_file/smollm2-135m-instruct-v1/special_tokens_map.json",
      "size_bytes": 655,
      "sha256": "2b7379f3ae813529281a5c602bc5a11c1d4e0a99107aaa597fe936c1e813ca52",
      "media_type": "application/octet-stream",
      "object_type": "base_model_file",
      "original_object_id": "smollm2-135m-instruct-v1"
    },
    {
      "path": "llm-foundations-bundle/objects/base_model_file/smollm2-135m-instruct-v1/tokenizer.json",
      "size_bytes": 2104556,
      "sha256": "9ca9acddb6525a194ec8ac7a87f24fbba7232a9a15ffa1af0c1224fcd888e47c",
      "media_type": "application/octet-stream",
      "object_type": "base_model_file",
      "original_object_id": "smollm2-135m-instruct-v1"
    },
    {
      "path": "llm-foundations-bundle/objects/base_model_file/smollm2-135m-instruct-v1/tokenizer_config.json",
      "size_bytes": 3764,
      "sha256": "4ec77d44f62efeb38d7e044a1db318f6a939438425312dfa333b8382dbad98df",
      "media_type": "application/octet-stream",
      "object_type": "base_model_file",
      "original_object_id": "smollm2-135m-instruct-v1"
    },
    {
      "path": "llm-foundations-bundle/objects/base_model_file/smollm2-135m-instruct-v1/vocab.json",
      "size_bytes": 800662,
      "sha256": "82b84012e3add4d01d12ba14442026e49b8cbbaead1f79ecf3d919784f82dc79",
      "media_type": "application/octet-stream",
      "object_type": "base_model_file",
      "original_object_id": "smollm2-135m-instruct-v1"
    }
  ],
  "payload_sha256": "aaaaaaaaaaaaaaaaaaaaaaaaaaaaaaaaaaaaaaaaaaaaaaaaaaaaaaaaaaaaaaaa"
}
