{
  "format": "llm-foundations-bundle-v1",
  "schema_version": 1,
  "edition": "intermediate-v1",
  "bundle_mode": "thin",
  "source": {
    "installation_id": "13131313-1313-4313-8313-131313131313",
    "app_version": "1.0.0"
  },
  "exported_at": "2026-09-28T12:00:00.000Z",
  "dependency_closure_complete": true,
  "contains_resume_state": false,
  "checkpoint_exports": [
    {
      "original_checkpoint_id": "10101010-1010-4010-8010-101010101010",
      "portability": "inference_only",
      "contains_resume_state": false
    }
  ],
  "omissions": [],
  "entries": [],
  "payload_sha256": "aaaaaaaaaaaaaaaaaaaaaaaaaaaaaaaaaaaaaaaaaaaaaaaaaaaaaaaaaaaaaaaa"
}
